<?xml version="1.0" encoding="UTF-8"?>
<xs:schema xmlns:xs="http://www.w3.org/2001/XMLSchema" elementFormDefault="qualified">

  <!-- Enumeraciones -->
  <xs:simpleType name="cicleType">
    <xs:restriction base="xs:string">
      <xs:enumeration value="DAM"/>
      <xs:enumeration value="DAW"/>
      <xs:enumeration value="ASIX"/>
      <xs:enumeration value="SMX"/>
      <xs:enumeration value="SEIA"/>
      <xs:enumeration value="ER"/>
      <xs:enumeration value="AUT"/>
    </xs:restriction>
  </xs:simpleType>

  <xs:simpleType name="departamentType">
    <xs:restriction base="xs:string">
      <xs:enumeration value="Informàtica"/>
      <xs:enumeration value="Electricitat"/>
      <xs:enumeration value="Automoció"/>
    </xs:restriction>
  </xs:simpleType>

  <!-- Root -->
  <xs:element name="cifp">
    <xs:complexType>
      <xs:choice minOccurs="0" maxOccurs="unbounded">
        <xs:element name="alumne" type="AlumneType"/>
        <xs:element name="professor" type="ProfessorType"/>
      </xs:choice>
    </xs:complexType>
  </xs:element>

  <!-- Tipos comunes -->
  <xs:complexType name="PersonaBaseType">
    <xs:sequence>
      <xs:element name="nom" type="xs:string"/>
      <xs:element name="llinatges" type="xs:string"/>
      <xs:element name="data_naixement" type="xs:string" minOccurs="0"/>
      <xs:element name="correu" type="xs:string" minOccurs="0"/>
      <xs:element name="telefon" type="xs:string" minOccurs="0"/>
      <xs:element name="adreca" type="xs:string" minOccurs="0"/>
    </xs:sequence>
    <xs:attribute name="id" type="xs:integer" use="required"/>
  </xs:complexType>

  <!-- Alumne -->
  <xs:complexType name="AlumneType">
    <xs:complexContent>
      <xs:extension base="PersonaBaseType">
        <xs:sequence>
          <xs:element name="data_matricula" type="xs:string"/>
          <xs:element name="curs" type="cicleType"/>
        </xs:sequence>
      </xs:extension>
    </xs:complexContent>
  </xs:complexType>

  <!-- Professor -->
  <xs:complexType name="ProfessorType">
    <xs:complexContent>
      <xs:extension base="PersonaBaseType">
        <xs:sequence>
          <xs:element name="data_incorporacio" type="xs:string"/>
          <xs:element name="departament" type="departamentType"/>
          <xs:element name="assignatura" type="AssignaturaType" minOccurs="0" maxOccurs="unbounded"/>
        </xs:sequence>
      </xs:extension>
    </xs:complexContent>
  </xs:complexType>

  <!-- Assignatura -->
  <xs:complexType name="AssignaturaType">
    <xs:sequence>
      <xs:element name="nom_assignatura">
        <xs:complexType>
          <xs:simpleContent>
            <xs:extension base="xs:string">
              <xs:attribute name="cicle" type="cicleType" use="required"/>
            </xs:extension>
          </xs:simpleContent>
        </xs:complexType>
      </xs:element>
      <xs:element name="data_inici" type="xs:string" minOccurs="0"/>
      <xs:element name="data_final" type="xs:string" minOccurs="0"/>
    </xs:sequence>
    <xs:attribute name="id_assignatura" type="xs:integer" use="required"/>
  </xs:complexType>

</xs:schema>
